{"$schema":"https://json-schema.org/draft/2020-12/schema","type":"object","required":["sourceId","provider","dataClass","targetTime","locationId","sourceRevision","values"],"properties":{"sourceId":{"type":"string"},"provider":{"type":"string"},"modelName":{"type":"string"},"dataClass":{"enum":["forecast","observation","reanalysis"]},"forecastIssuedAt":{"type":"string","format":"date-time"},"publishedAt":{"type":"string","format":"date-time"},"targetTime":{"type":"string","format":"date-time"},"locationId":{"type":"string"},"nativeGranularityMinutes":{"type":"integer","minimum":1},"sourceRevision":{"type":"string"},"values":{"type":"object"}},"allOf":[{"if":{"properties":{"dataClass":{"const":"forecast"}}},"then":{"required":["forecastIssuedAt"]},"else":{"required":["publishedAt"],"not":{"required":["forecastIssuedAt"]}}}]}
